{
  "versao": "1.0",
  "id_lote": "9c1e4f72-8b3d-4a06-a5e9-2f7d0b6c1e84",
  "origem": "borda-sede-boa-vista",
  "mensagens": [
    {
      "versao": "1.0",
      "id_mensagem": "1a2b3c4d-5e6f-4a7b-8c9d-0e1f2a3b4c5d",
      "dispositivo": "silo-02-temp",
      "tipo": "evento",
      "timestamp": "2026-10-21T03:40:00Z",
      "via": "borda-sede-boa-vista",
      "evento": { "codigo": "alarme_temperatura_alta" }
    },
    {
      "versao": "1.0",
      "id_mensagem": "2b3c4d5e-6f7a-4b8c-9d0e-1f2a3b4c5d6e",
      "dispositivo": "solo-talhao07-02",
      "tipo": "telemetria",
      "timestamp": "2026-10-21T03:45:00Z",
      "via": "borda-sede-boa-vista",
      "medidas": [{ "grandeza": "umidade_solo", "valor": 22.9, "unidade": "%" }]
    },
    {
      "versao": "1.0",
      "id_mensagem": "3c4d5e6f-7a8b-4c9d-8e1f-2a3b4c5d6e7f",
      "dispositivo": "valvula-talhao07",
      "tipo": "estado",
      "timestamp": "2026-10-21T03:46:00Z",
      "via": "borda-sede-boa-vista",
      "estado": { "valvula": "aberta" }
    }
  ]
}
